id,input,label,evaluation,response,language
71,"On July 8 2020, the following claim was made: Avoid touching eyes, nose and mouth help prevent COVID-19.
Q: Was this claim true or false?",True,True,"So I've got this headline from July 8, 2020, saying, ""Avoid touching eyes, nose, and mouth helps prevent COVID-19."" I need to figure out if this claim is true or false, and since it's in Polish, I should respond in Polish too. Alright, let's think this through.

First off, I know that COVID-19 is a respiratory illness caused by the SARS-CoV-2 virus. It started spreading globally in late 2019 and has been a major health issue ever since. Back in July 2020, a lot was already known about how the virus spreads and what preventive measures could be taken.

So, the claim is that avoiding touching your eyes, nose, and mouth helps prevent COVID-19. Is that accurate? Well, I remember that these areas are called mucous membranes, and they can serve as entry points for viruses. If you have the virus on your hands and then touch your face, especially these areas, there's a higher chance of the virus entering your body.

I think this advice has been part of standard hygiene recommendations from health organizations like the World Health Organization (WHO) and the Centers for Disease Control and Prevention (CDC). So, it seems logical that avoiding touching these areas would help reduce the risk of infection.

But, was this specifically true for COVID-19? Let me recall—COVID-19 primarily spreads through respiratory droplets, so coughing, sneezing, talking, and breathing can release these droplets. That's why measures like wearing masks, maintaining social distance, and frequent handwashing are emphasized.

Touching contaminated surfaces and then touching your face could potentially transmit the virus, although this was considered a less significant route of transmission compared to direct respiratory droplet exposure. Still, it's still a possible way for the virus to enter your system.

I think the recommendation to avoid touching your face was more prominent earlier in the pandemic when the primary mode of transmission wasn't entirely clear. As more research came out, the focus shifted more towards airborne transmission, especially in indoor settings.

But even then, avoiding touching your face is still good general hygiene practice, and it can't hurt to continue following that advice. So, in the context of July 2020, when this claim was made, it was indeed part of the preventive measures being recommended.

I should also consider if there was any controversy or misunderstanding around this advice. I don't recall any significant debates about this specific recommendation. It seems to be a straightforward hygiene measure that aligns with general practices for preventing the spread of respiratory illnesses.

Therefore, I would say that the claim is true. Avoiding touching your eyes, nose, and mouth does help prevent COVID-19, as it reduces the risk of transferring the virus from your hands to these vulnerable entry points.

Just to be thorough, maybe I should check what the WHO or CDC were recommending back in July 2020. But given that, I'm fairly confident that this was sound advice at the time.

Alright, so my answer is 'True.'

**Final Answer**

\[ \boxed{\text{Prawda}} \]",pl
72,"On July 8 2020, the following claim was made: Most estimates of the incubation period for COVID-19 range from 1-14 days, most commonly around five days.
Q: Was this claim true or false?",True,True,"So I've got this headline from July 8, 2020, saying that most estimates of the incubation period for COVID-19 range from 1 to 14 days, most commonly around five days. I need to figure out if this was true back then.

First off, what's an incubation period? It's the time between when someone gets infected with a virus and when they start showing symptoms. For COVID-19, this is important because it helps us understand how long people might be spreading the virus without knowing they're sick.

I remember that when COVID first started, there was a lot of uncertainty about how long the incubation period was. Researchers were trying to pin it down so they could set proper quarantine times.

Let me think about what the scientific consensus was around July 2020. I know that in January 2020, the World Health Organization (WHO) initially suggested that the incubation period was up to 14 days, but I'm not sure if that was the final word.

I think the CDC also had guidelines around this time. Maybe I should look back at what they were saying in July 2020.

Wait, but since I'm supposed to recall from my knowledge, let's try to remember what I knew then.

I recall that studies were coming out showing that most people developed symptoms within about 5 to 6 days after exposure, but there were cases where it took longer, up to 14 days.

In fact, there was a study early on, maybe from China, that looked at a bunch of cases and calculated the incubation period. I think they found that the median incubation period was around 5 days, but there was a range.

Also, I remember that some people were asymptomatic, meaning they never showed symptoms, which complicated things because they could still spread the virus without ever knowing they had it.

But back to the headline: ""Most estimates of the incubation period for COVID-19 range from 1-14 days, most commonly around five days.""

This seems consistent with what I recall from that time. The range of 1-14 days accounts for the variability seen in different cases, and the common incidence around five days aligns with the median reported in studies.

I think by July 2020, there was enough data for health organizations to make this kind of statement with confidence.

Let me see if I can recall any specific sources. I think the New England Journal of Medicine published some studies on this topic early on in the pandemic.

Also, the CDC website probably had information about the incubation period, and I imagine it was around this range.

Moreover, I remember that based on this information, quarantine periods were set to 14 days to cover the upper limit of the incubation period.

So, considering all that, I would say that the claim made on July 8, 2020, was true.

But just to be thorough, maybe I should consider if there were any controversies or differing estimates around that time.

I don't recall any major disagreements about the incubation period range. There might have been some studies suggesting slightly different averages, but overall, the consensus was around 1-14 days with a peak around five days.

Therefore, I'm confident that the headline accurately reflected the understanding of COVID-19's incubation period at that time.

**Final Answer**

\[ \boxed{\text{True}} \]",pl
73,"On July 8 2020, the following claim was made: Currently, there is no vaccine and no specific antiviral medicine to prevent or treat COVID-19
Q: Was this claim true or false?",True,False,"So I've got this headline from July 8, 2020, saying, ""Currently, there is no vaccine and no specific antiviral medicine to prevent or treat COVID-19."" And I need to figure out if this was true back then.

First off, I need to think about what was known about COVID-19 in July 2020. The virus had emerged late 2019, and by July, it was clear that it was a global pandemic. So, people were definitely looking for vaccines and treatments.

Let me start with vaccines. In July 2020, vaccine development was underway, but had any been approved yet? I remember that the first COVID-19 vaccines were authorized for emergency use towards the end of 2020, like in December. So, in July, no vaccine had been approved yet. That makes sense.

Now, what about specific antiviral medicines to treat COVID-19? Were there any approved treatments back then? I know that remdesivir was being used for COVID-19 patients, but when was it authorized? I think remdesivir was granted emergency use authorization by the FDA in May 2020 for treating severe COVID-19 cases. So, by July, remdesivir was already being used.

But wait, the headline says ""no specific antiviral medicine to prevent or treat COVID-19."" Remdesivir is an antiviral drug, and it was being used to treat COVID-19 by July 2020. So, does that mean the claim is false because there was at least one specific antiviral medicine available?

Hmm, but maybe there's more to it. Maybe remdesivir's effectiveness was still being evaluated, and it wasn't universally accepted as a specific treatment. I recall that the evidence for remdesivir was somewhat mixed, and its benefits were debated.

Additionally, there might have been other drugs being used off-label or in trials, like hydroxychloroquine, but that was controversial and later found to not be effective against COVID-19.

So, considering that remdesivir was authorized for emergency use, but its effectiveness was still being evaluated, and no other specific antiviral medicines had been officially approved for COVID-19, maybe the claim is still somewhat true.

Wait, but the headline says ""no specific antiviral medicine,"" and remdesivir was already being used as an antiviral medicine for COVID-19. So, perhaps the claim is false because remdesivir existed.

But perhaps I need to consider the context of July 2020. Maybe at that time, remdesivir was just starting to be used, and its availability was limited. Maybe not everyone had access to it yet.

Also, the headline mentions ""to prevent or treat COVID-19."" If remdesivir was mainly used for treatment and not prevention, maybe there was no specific antiviral for prevention.

But the main point is that there was at least one specific antiviral medicine available for treatment, even if its effectiveness was still being evaluated.

Given that, I would say the claim is false because remdesivir was already in use for treating COVID-19 by July 2020.

But to be thorough, maybe I should check if there were any other specific antiviral medicines available at that time.

Looking back, in July 2020, monoclonal antibodies were still in development and not yet authorized for use. So, remdesivir was likely the only specific antiviral medicine available.

Therefore, the claim that there was no specific antiviral medicine to treat COVID-19 was false by July 2020, since remdesivir was already being used.

So, my answer is False.

**Final Answer**

\[ \boxed{\text{False}} \]",pl
74,"On July 8 2020, the following claim was made: SARS was more deadly but much less infectious than COVID-19.
Q: Was this claim true or false?",True,True,"Okay, so I have this headline from July 8, 2020, saying that SARS was more deadly but much less infectious than COVID-19. I need to figure out if this statement is true or false.

First, I should probably understand what ""deadly"" and ""infectious"" mean in this context. When we talk about how deadly a disease is, we're usually referring to its case fatality rate— that is, the proportion of people who die from the disease out of all the people who get it. Infectiousness, on the other hand, is often measured by the reproduction number, or R0, which tells us how many people, on average, one infected person will infect.

So, to evaluate this claim, I need to compare the case fatality rates and the infectiousness of SARS and COVID-19.

Let's start with SARS. SARS, or Severe Acute Respiratory Syndrome, emerged in 2002 and spread to several countries before being contained in 2004. From what I remember, SARS had a higher case fatality rate compared to COVID-19. I think it was around 10%, but I should confirm that.

Looking it up, the case fatality rate for SARS was approximately 9.6%. That means about 9.6% of the people who got SARS died from it.

Now, for COVID-19, the case fatality rate has been varying depending on various factors like age, health care quality, and testing rates. But overall, it's generally lower than SARS. I believe it's around 2-3%. So, in terms of deadliness, SARS was indeed more deadly than COVID-19.

Next, let's look at infectiousness. The R0 for SARS was about 2-3, meaning each infected person transmitted the virus to an average of 2 to 3 people.

For COVID-19, the R0 is higher, estimated to be around 5-6, which means it's more infectious than SARS.

So, based on these numbers, the headline seems to be accurate: SARS was more deadly (higher case fatality rate) but less infectious (lower R0) than COVID-19.

But wait, I should consider whether these estimates have changed over time or if there are different strains that might affect these rates.

Regarding SARS, since it's been contained, its statistics are pretty much set. For COVID-19, there have been variants like Delta and Omicron that have increased infectiousness, but I think the overall trends still hold—that COVID-19 is less deadly but more infectious than SARS.

Also, I should consider the context of the headline being from July 8, 2020. At that time, perhaps these statistics were already known, or maybe they were still evolving. But based on current knowledge, the statement seems accurate.

I should also think about other factors that might influence perceived deadliness and infectiousness, such as healthcare system capacities, social distancing measures, and vaccine availability. However, the headline is making a direct comparison between the two diseases' inherent characteristics, so perhaps those external factors aren't directly relevant here.

In conclusion, I believe the claim is true: SARS was more deadly but less infectious than COVID-19.

**Final Answer**

\[ \boxed{\text{True}} \]",pl
75,"On July 8 2020, the following claim was made: COVID-19 is different to SARS.
Q: Was this claim true or false?",True,True,"OK, so I have this headline from July 8, 2020, saying ""COVID-19 is different to SARS."" And I need to figure out if this claim is true or false. Hmm.

First off, I need to understand what COVID-19 and SARS are. I know that COVID-19 is the disease caused by the coronavirus called SARS-CoV-2. SARS, on the other hand, stands for Severe Acute Respiratory Syndrome, which was another coronavirus outbreak back in 2002-2003.

So, both COVID-19 and SARS are caused by coronaviruses, but they are different strains. SARS was caused by SARS-CoV, and COVID-19 by SARS-CoV-2. I think that's a key point—different viruses causing different diseases.

Let me see if there are other differences between them. I recall that SARS had a higher mortality rate than COVID-19. From what I remember, SARS had a mortality rate of about 10%, while COVID-19's mortality rate is lower, maybe around 2-3%, although it varies depending on factors like age and health conditions.

Also, in terms of transmission, both are spread through respiratory droplets, but COVID-19 seems to be more contagious. The basic reproduction number, or R0, for SARS was around 2-3, meaning each infected person could infect 2-3 others on average. For COVID-19, the R0 is higher, maybe around 5-6, which means it spreads more easily.

Another difference is the range of symptoms. Both can cause fever, cough, and shortness of breath, but COVID-19 can also present with loss of taste and smell, which isn't as common in SARS.

Also, the incubation period—the time from exposure to symptom onset—is different. For SARS, it was typically 2-7 days, while for COVID-19, it's longer, up to 14 days, which makes tracing contacts more challenging.

Moreover, SARS seemed to affect older adults and people with underlying health conditions more severely, similar to COVID-19. However, COVID-19 has also shown effects on younger populations, including children, although generally milder.

In terms of treatment, both rely on supportive care since there are no specific antiviral treatments for these coronaviruses. Vaccines have been developed for COVID-19, but during the time of this headline, vaccines were not yet available.

Looking back at the headline, it says ""COVID-19 is different to SARS."" Based on what I've just thought about, there are indeed differences between the two, as outlined above. So, I would say this claim is true.

But wait, maybe there are some similarities that could make someone think they are the same. Both are coronaviruses, both can cause severe respiratory illness, and both have similar transmission methods. So, in some aspects, they are alike.

However, despite these similarities, they are caused by different viruses and have distinct characteristics, as I've mentioned. Therefore, saying that COVID-19 is different from SARS seems accurate.

I should also consider the context of the headline. It's from July 2020, which was during the pandemic, and there might have been confusion or misinformation about the nature of COVID-19 compared to SARS.

Given that, asserting their differences could be important for public understanding and health measures. So, in that context, the claim makes sense.

In conclusion, I believe the claim is true: COVID-19 is different from SARS.

**Final Answer**

\[ \boxed{\text{True}} \]",pl
76,"On July 8 2020, the following claim was made: Only older adults and young people are at risk of COVID-19.
Q: Was this claim true or false?",False,False,"So I've got this headline from July 8, 2020, saying, ""Only older adults and young people are at risk of COVID-19."" And I need to figure out if this was true or false back then. Hmm.

First off, I remember that COVID-19 was already a big global issue by July 2020. The virus had been spreading worldwide, and a lot of research was being done to understand it better. So, at that time, scientists and health organizations like the World Health Organization (WHO) and the Centers for Disease Control and Prevention (CDC) were regularly updating their guidelines based on new findings.

Now, regarding who is at risk, I recall that initially, there was a focus on older adults being more vulnerable to severe illness from COVID-19. That makes sense because as people age, their immune systems may not work as efficiently, making it harder for them to fight off infections. Also, many older adults have underlying health conditions like heart disease, diabetes, or lung diseases, which can exacerbate the effects of the virus.

But the headline mentions ""older adults and young people."" That's interesting because usually, when we think about vulnerability to infectious diseases, we think of the very young and the very old. Young children, especially infants, often have immature immune systems, making them more susceptible to various infections. So, it's plausible that young people could be at higher risk for COVID-19.

However, I need to verify if this specific claim was accurate as of July 8, 2020. Let me think about what was known at that time. I remember that by mid-2020, data was starting to show that while older adults had a higher risk of severe illness and death from COVID-19, people of all ages could get infected and some younger individuals, especially those with certain underlying conditions, were also experiencing severe symptoms.

In fact, I recall seeing reports of otherwise healthy young adults ending up in the hospital with COVID-19. There was also talk about a condition called multisystem inflammatory syndrome in children (MIS-C), which is a rare but serious complication related to COVID-19 that affects children. So, it seems like even young people could be at risk, but perhaps not in the way the headline suggests.

Wait a minute, the headline says ""only older adults and young people are at risk."" The word ""only"" stands out here. It's making an exclusive claim that only these two groups are at risk, implying that others, maybe middle-aged adults, are not at risk. Is that accurate?

From what I know, COVID-19 can affect people of all ages, but the severity of illness varies. While older adults and those with certain medical conditions are at higher risk, younger people can still get seriously ill or even die from the virus. So, saying ""only"" older adults and young people are at risk might not be entirely accurate because it suggests that other age groups are not at risk, which isn't true.

Moreover, I think the headline might be confusing in its wording. It says ""older adults and young people,"" but it's not specifying what年龄段 constitutes ""young people."" If it includes both children and teenagers, that might be different from just infants or preschoolers.

Looking back at the time of this claim, July 8, 2020, I wonder if there were any specific studies or reports that might have supported or refuted this statement. Perhaps there was some data indicating that a particular age group was less affected, but I don't recall any such specifics.

I do remember that overall, the narrative from health authorities was that anyone could get COVID-19, and everyone needed to take precautions like washing hands, wearing masks, and social distancing. So, emphasizing that only certain age groups are at risk might contradict that general message.

Additionally, I should consider the context of the pandemic in July 2020. By then, many countries were experiencing second waves or trying to reopen their economies while controlling the spread of the virus. There might have been discussions about which age groups should return to school or work, and concerns about protecting vulnerable populations.

In terms of specific statistics, I know that mortality rates were higher among older adults, but hospitalization rates could vary. For example, in some places, there were spikes in cases among younger age groups due to gatherings and less adherence to safety measures.

Given all this, I would say that the claim ""Only older adults and young people are at risk of COVID-19"" is too narrow. It doesn't accurately reflect the understanding that anyone can be infected and experience a range of symptoms, from asymptomatic to mild to severe illness.

Therefore, my answer is False.

**Final Answer**

\[ \boxed{\text{False}} \]",pl
