id,input,label,evaluation,response,language
105,"On July 8 2020, the following claim was made: Most people recover from the COVID-19 without needing hospital treatment.
Q: Was this claim true or false?",True,True,"So I have this headline from July 8, 2020, saying, ""Most people recover from COVID-19 without needing hospital treatment."" And I need to figure out if this was true or false at that time.

First, I should think about what was known about COVID-19 in July 2020. By then, the pandemic had been going on for a few months, and there was quite a bit of data collected from different countries.

I remember that COVID-19 affects people differently. Some people have mild symptoms and can recover at home, while others get severely ill and need hospital care, including intensive care units.

So, to determine if most people recover without needing hospital treatment, I need to look at the case-fatality rate and the proportion of cases that require hospitalization.

I think about the overall mortality rate of COVID-19. I recall that it's higher than seasonal flu but lower than other diseases like SARS or MERS. But mortality rates can vary depending on age and underlying health conditions.

Moreover, not everyone who gets COVID-19 needs to be hospitalized. In fact, a significant proportion of cases are mild or asymptomatic.

I should look for statistics from around that time to get a better idea. Maybe I can recall some numbers or find reliable sources that report on this.

From what I remember, studies were suggesting that about 80% of COVID-19 cases were mild, meaning they didn't require hospitalization. The remaining 20% had severe or critical symptoms and might need hospital care.

So, if 80% of cases are mild and can be managed at home, that would support the claim that most people recover without needing hospital treatment.

But I should consider whether this proportion varied in different populations or age groups. For example, older adults and those with pre-existing conditions are more likely to have severe symptoms and require hospitalization.

Also, the availability of medical care could affect these numbers. In places with overwhelmed healthcare systems, some who needed hospital care might not have been able to get it.

Additionally, asymptomatic recovery was becoming more recognized as a possibility, which would further increase the proportion of people who don't need hospital treatment.

I should also think about the long-term effects of COVID-19. Some people, even those with mild initial symptoms, may experience lingering symptoms after recovery, sometimes referred to as ""long COVID."" But in terms of immediate hospitalization needs, they might not have required it.

Given all this, it seems that the claim was likely true in July 2020. Most people with COVID-19 did recover without needing hospital treatment.

However, it's important to note that even if most cases are mild, the overall impact can be significant because of the high传染性of the virus. A large number of mild cases can still lead to a substantial number of severe cases and deaths, especially in vulnerable populations.

Moreover, the situation was evolving rapidly, and new variants could change the disease's severity over time.

But specifically for July 2020, based on the available information, I would say the claim is true.

**Final Answer**

\[ \boxed{\text{True}} \]",pl
106,"On July 8 2020, the following claim was made: COVID-19 can survive temperatures higher than 25 celsius.
Q: Was this claim true or false?",True,True,"Headline: ""On July 8, 2020, the following claim was made: COVID-19 can survive temperatures higher than 25 Celsius.""

Question: Was this claim true or false?

To answer this question, I need to understand what was known about the survival of the COVID-19 virus in different temperature conditions around that time.

First, I should recall that COVID-19 is caused by the SARS-CoV-2 virus. The survivability of viruses, including coronaviruses, can be influenced by environmental factors such as temperature, humidity, and surface type.

I remember that during the early stages of the pandemic, there was a lot of research and discussion about how temperature affects the virus's survival. Some studies suggested that higher temperatures might reduce the virus's viability, but I need to verify if this was a universal consensus or if there were exceptions.

Looking back at the scientific literature around July 2020, I can think of a few key points:

1. **Temperature and Virus Survival:** Generally, enveloped viruses like coronaviruses are sensitive to heat. Higher temperatures can denature viral proteins and render the virus non-infectious more quickly.

2. **Specific Studies:** There were laboratory studies that tested the survival of SARS-CoV-2 at different temperatures. For example, a study might have shown that the virus survives for a shorter time on surfaces at higher temperatures compared to cooler conditions.

3. **Real-World Observations:** In terms of transmission patterns, some regions with higher temperatures did experience outbreaks, which suggests that the virus can indeed survive and transmit in warmer climates.

4. **Humidity Factors:** It's also important to consider humidity because it can interact with temperature to affect viral survival. Higher humidity can sometimes prolong virus viability, but this depends on the specific conditions.

Given these points, I need to determine whether, as of July 8, 2020, there was evidence to support the claim that COVID-19 can survive temperatures higher than 25°C.

First, 25°C is approximately 77°F, which is a fairly warm temperature. If the virus can survive at this temperature and above, it would have implications for疫情防控 measures in tropical and subtropical regions.

I recall that several studies had been published by July 2020 indicating that SARS-CoV-2 can remain viable on surfaces at various temperatures, including those above 25°C. For instance, a study might have found that the virus remains infectious on certain surfaces for hours even at higher temperatures, although its viability decreases compared to cooler conditions.

Moreover, there were reports of outbreaks in countries with high ambient temperatures, suggesting that the virus could indeed survive and spread in such environments.

Therefore, it seems plausible that the claim made on July 8, 2020, was true: COVID-19 can survive temperatures higher than 25°C.

However, to be thorough, I should consider any contrary evidence or opinions that might have existed at that time.

Were there any studies suggesting that the virus cannot survive above a certain temperature? I don't recall any such definitive thresholds being established. Most research pointed towards a gradual decrease in viability with increasing temperature, but not an abrupt cessation at a specific temperature point.

Additionally, it's essential to note that survivability on surfaces is just one aspect. The transmission of the virus also depends on human behavior, humidity levels, and other factors.

Given this information, I conclude that the claim was likely true as of July 8, 2020: COVID-19 can survive temperatures higher than 25°C.

**Final Answer**

\[ \boxed{\text{True}} \]",pl
107,"On July 8 2020, the following claim was made: The COVID-19 virus may also be spread when an infected person sneezes, coughs or exhales, and people around them breathe in these micro-droplets.
Q: Was this claim true or false?",True,True,"Headline: On July 8, 2020, the following claim was made: The COVID-19 virus may also be spread when an infected person sneezes, coughs or exhales, and people around them breathe in these micro-droplets.

Q: Was this claim true or false?

Alright, I need to determine if this headline is true or false. The headline is about how the COVID-19 virus can spread when an infected person sneezes, coughs, or exhales, and others breathe in those tiny droplets. This was claimed on July 8, 2020.

First, I should think about what I know about COVID-19 transmission. From what I've learned, COVID-19 is primarily spread through respiratory droplets when an infected person coughs, sneezes, talks, or breathes. These droplets can be inhaled by people nearby or land on surfaces that others might touch, potentially infecting them if they then touch their face.

So, the headline says that the virus may be spread when an infected person sneezes, coughs, or exhales, and people around them breathe in these micro-droplets. This sounds consistent with what I know about COVID-19 transmission.

But, I should check if there was any specific information or updates around July 8, 2020, that might make this claim inaccurate. Let me think about the state of knowledge back then.

In 2020, the understanding of COVID-19 was evolving rapidly as more research was being done. In earlier stages, there was some debate about the role of aerosols versus droplets in transmission. Aerosols are tiny particles that can stay suspended in the air for longer periods, while larger droplets typically fall to the ground较快。

By July 2020, many health organizations, including the World Health Organization (WHO) and the Centers for Disease Control and Prevention (CDC), recognized that COVID-19 could spread through both large droplets and smaller aerosols.

For example, the WHO had acknowledged that airborne transmission could occur in specific settings, like crowded and poorly ventilated spaces, where aerosols could build up and remain infectious.

So, given that context, the claim that the virus may be spread when an infected person sneezes, coughs, or exhales, and people around them breathe in these micro-droplets, seems accurate for July 8, 2020.

Moreover, practices like wearing masks, maintaining physical distance, and improving ventilation were recommended to reduce the spread of the virus through these droplets and aerosols.

Therefore, based on the knowledge and recommendations available around that time, this headline is true.

**Final Answer**

\[ \boxed{\text{True}} \]",pl
108,"On July 8 2020, the following claim was made: Wearing a medical mask can limit the spread of certain respiratory viral diseases including COVID-19.
Q: Was this claim true or false?",True,True,"Alright, so I have this headline from July 8, 2020, saying that wearing a medical mask can limit the spread of certain respiratory viral diseases, including COVID-19. I need to figure out if this was true or false back then.

First off, I remember that COVID-19 is caused by a virus called SARS-CoV-2, and it's a respiratory disease. So, it makes sense that masks could play a role in preventing its spread since it's transmitted through respiratory droplets.

Around that time, in 2020, there was a lot of discussion about masks and their effectiveness against COVID-19. I think public health organizations were starting to recommend masks more strongly as the pandemic progressed.

Let me think about what the World Health Organization (WHO) was saying back then. I recall that initially, WHO had some guidance about masks being mainly for people who were sick and for healthcare workers. But as more research came out, they started recommending that healthy people should also wear masks in public settings, especially where social distancing was hard to maintain.

So, by July 2020, I believe WHO had updated their recommendations to suggest that wearing masks could help reduce the transmission of COVID-19, even for people who don't show any symptoms.

Also, scientists were studying how viruses spread via respiratory droplets and aerosols. Studies were showing that masks can catch these droplets, preventing them from being expelled into the air when someone talks, coughs, or sneezes.

Moreover, countries that adopted widespread mask-wearing seemed to have lower transmission rates of COVID-19. For example, Asian countries like South Korea and Japan had culturally higher acceptance of mask-wearing during respiratory illnesses, and their infection rates were comparatively lower.

So, based on the evolving scientific understanding and public health recommendations as of July 2020, it seems that wearing a medical mask does limit the spread of certain respiratory viral diseases, including COVID-19.

Therefore, the claim made on July 8, 2020, is true.

**Final Answer**

\[ \boxed{\text{True}} \]",pl
109,"On July 8 2020, the following claim was made: Women with confirmed or suspected COVID-19 can breastfeed if they wish to do so.
Q: Was this claim true or false?",True,True,"So I have this headline from July 8, 2020, saying that women with confirmed or suspected COVID-19 can breastfeed if they wish to do so. I need to figure out if this claim is true or false based on what I know and any context I can think of. And I have to answer in Polish, which is a bit tricky, but I'll try.

First, I need to understand what the claim is about. It's regarding breastfeeding by women who have or are suspected to have COVID-19. The claim says they can breastfeed if they wish to do so. So, is this accurate according to health guidelines at that time?

I recall that during the early days of the pandemic, there was a lot of uncertainty about how COVID-19 could affect breastfeeding. Some initial thoughts were that maybe breastfeeding shouldn't be recommended for mothers with COVID-19 because of the risk of transmitting the virus to the baby.

But as more research was conducted, health organizations started to provide clearer guidelines. I think the World Health Organization (WHO) has been quite active in providing advice on this matter.

Let me see what WHO recommends. From what I remember, WHO has always promoted breastfeeding whenever possible, even in the context of COVID-19. They suggest that the benefits of breastfeeding outweigh the potential risks of virus transmission.

Wait, but how is that possible? Doesn't the virus can be passed from mother to child?

Well, actually, the virus hasn't been detected in breast milk itself in several studies. So, it's thought that the risk of transmitting COVID-19 through breast milk is low. However, there is a possibility of transmission through respiratory droplets during breastfeeding, especially if the mother coughs or sneezes near the baby.

Given that, WHO recommends that mothers with confirmed or suspected COVID-19 can continue breastfeeding, but they should take certain precautions to protect their babies. These precautions include wearing a mask while breastfeeding, washing hands before and after接触婴儿, and cleaning breast pumps and other feeding equipment carefully.

So, if that's the case, then the claim from July 8, 2020, seems to align with WHO's recommendations. But was this recommendation already in place by July 8, 2020?

Let me check the timeline. I think WHO updated their advice on COVID-19 and breastfeeding several times during the pandemic. Maybe I can look up when these guidelines were first issued.

Hmm, without internet access, it's hard to verify the exact date. But I believe that by July 2020, WHO had already released guidance supporting breastfeeding with precautions for mothers with COVID-19.

Additionally, other health organizations like UNICEF and the Centers for Disease Control and Prevention (CDC) in the USA also support breastfeeding with appropriate防护措施.

So, based on this information, I would say that the claim is true. Women with confirmed or suspected COVID-19 can breastfeed if they wish to do so, provided they take the necessary precautions to minimize the risk of transmitting the virus to their babies.

But just to be thorough, maybe I should consider any counterarguments or opposing views. Are there any studies or opinions that suggest otherwise?

I recall that some people were concerned about the potential for viral transmission through breast milk itself. But as I mentioned earlier, studies haven't found evidence of live virus in breast milk, which reduces that risk.

Another consideration is whether the benefits of breastfeeding are still applicable during a pandemic. WHO and other health agencies seem to think that the nutritional and immunological benefits of breastfeeding are crucial, especially in times when infants might be more vulnerable to infections.

Therefore, overall, the claim appears to be accurate based on the guidelines available around that time.

Just to make sure, maybe I should consider the context in Poland specifically, since the question is to be answered in Polish. Perhaps there were local regulations or recommendations that differed from international guidelines.

I don't have specific information about Polish health policies regarding COVID-19 and breastfeeding, but generally, European countries follow WHO recommendations unless there's a specific reason not to.

Given all this, I'm confident that the claim is true. Women with confirmed or suspected COVID-19 can breastfeed if they wish to do so, as long as they take the appropriate precautions.

So, my answer is: Prawda.

**Final Answer**

\[ \boxed{\text{Prawda}} \]",pl
110,"On July 8 2020, the following claim was made: For COVID-19, other flu-like symptoms such as aches and pains, nasal congestion, runny nose, sore throat or diarrhoea are also common.
Q: Was this claim true or false?",True,True,"Headline: On July 8, 2020, the following claim was made: For COVID-19, other flu-like symptoms such as aches and pains, nasal congestion, runny nose, sore throat or diarrhoea are also common.

Q: Was this claim true or false?

So I need to figure out if this statement from July 8, 2020, about COVID-19 symptoms is true or false. The claim is that besides the main symptoms, there are other flu-like symptoms like aches and pains, nasal congestion, runny nose, sore throat, or diarrhea that are common in COVID-19.

First, I should recall what was known about COVID-19 symptoms around that time. COVID-19 is caused by the SARS-CoV-2 virus, and it was first identified in late 2019. By July 2020, there had been a significant amount of research and documentation on the disease.

The main symptoms that were widely recognized by then included fever, dry cough, and shortness of breath. But the statement is talking about other flu-like symptoms being common in COVID-19 cases.

I remember that flu-like symptoms can include things like body aches, fatigue, sore throat, and sometimes gastrointestinal issues like diarrhea. So, are these common in COVID-19?

From what I recall, aches and pains, or myalgia, were listed as possible symptoms of COVID-19. Nasal congestion and runny nose were also mentioned, but I think their prevalence varied. Sore throat could be a symptom, though maybe not as commonly reported as cough or fever. Diarrhea was also recognized as a possible symptom, especially in some studies that suggested gastrointestinal involvement.

But the key word here is ""common."" Are these symptoms common in COVID-19?

I think it's important to look at the sources of information from around that time. The World Health Organization (WHO) and the Centers for Disease Control and Prevention (CDC) were major sources for information on COVID-19 symptoms.

Let me try to recall the WHO's description of COVID-19 symptoms in July 2020. I think they listed the main symptoms as fever, dry cough, and tiredness, and mentioned that some people may have aches and pains, nasal congestion, sore throat, or diarrhea.

Similarly, the CDC had information on their website about the spectrum of symptoms associated with COVID-19, which included those mentioned in the headline.

But to determine if these symptoms were common, I need to consider the prevalence rates. Were these symptoms reported frequently in COVID-19 cases?

I recall that studies were emerging that looked at large cohorts of patients and documented the frequency of various symptoms. For example, a study might report that fever was present in 80-90% of cases, while cough was around 60-70%. Symptoms like sore throat and runny nose might be less common, say in the range of 10-30%.

So, were aches and pains common? Probably yes, considering that myalgia is a known symptom.

Nasal congestion and runny nose: These seem to be less commonly reported in COVID-19 compared to flu, but still possible.

Sore throat: Similarly, it was present in some cases but maybe not as frequently as cough or fever.

Diarrhea: There were reports of gastrointestinal symptoms in a portion of patients, but again, not as common as the main respiratory symptoms.

So, overall, while these symptoms can occur in COVID-19, their commonality might be lower compared to the main symptoms like fever and cough.

But the statement says ""also common,"" which might be a bit subjective. If by ""common,"" they mean occurring in a significant proportion of cases, then perhaps it's accurate.

Alternatively, if ""common"" is interpreted as being among the most frequently reported symptoms, then maybe not.

Given that, I think the claim is somewhat true, but perhaps slightly exaggerated.

Wait, but the question is to determine if the claim is true or false, and to answer in Polish.

Hmm.

Let me think differently. If I consider that these symptoms can be present in COVID-19 and were recognized as possible symptoms by health authorities at that time, then the claim is true.

However, if I consider that they are not the most common or primary symptoms, then perhaps it's false.

But the statement doesn't specify that they are the main symptoms, just that they ""are also common.""

I think that health organizations like WHO and CDC did list these as possible symptoms, so from that perspective, the claim is true.

Additionally, there was recognition that COVID-19 could present with a variety of symptoms, including some that overlap with flu-like illnesses.

Therefore, I would say that the claim is true.

**Final Answer**

\[ \boxed{\text{Prawda}} \]",pl
